{
  "$schema": "https://json-schema.org/draft/2020-12/schema",
  "$id": "https://qrtrust.local/contracts/scanner-decision.schema.json",
  "title": "QR Trust scanner-visible decision",
  "type": "object",
  "required": [
    "decision_id",
    "decided_at",
    "decision_color",
    "decision_state",
    "reason_codes",
    "destination",
    "trust_path",
    "hold_to_open",
    "cache_freshness",
    "residual_vector",
    "model_decision"
  ],
  "properties": {
    "decision_id": {
      "type": "string",
      "minLength": 1
    },
    "decided_at": {
      "type": "string",
      "format": "date-time"
    },
    "decision_color": {
      "enum": [
        "green",
        "orange",
        "red"
      ]
    },
    "decision_state": {
      "type": "string",
      "enum": [
        "verified_issuer",
        "verified_issuer_destination_risky",
        "verified_issuer_runtime_unavailable",
        "verified_issuer_runtime_blocked",
        "verified_issuer_cache_stale",
        "verified_issuer_cache_expired",
        "verified_issuer_cache_unavailable",
        "plain_url_unrecognized",
        "destination_policy_mismatch",
        "check_unavailable_destination_visible"
      ]
    },
    "reason_codes": {
      "type": "array",
      "items": {
        "type": "string",
        "minLength": 1
      }
    },
    "risk_score": {
      "type": "integer",
      "minimum": 0,
      "maximum": 100
    },
    "destination": {
      "type": "object",
      "required": [
        "display_host",
        "fingerprint",
        "url"
      ],
      "properties": {
        "display_host": {
          "type": "string",
          "minLength": 1
        },
        "fingerprint": {
          "type": "string",
          "minLength": 1
        },
        "url": {
          "type": "string"
        },
        "resolver_url": {
          "type": [
            "string",
            "null"
          ]
        },
        "final_url": {
          "type": [
            "string",
            "null"
          ]
        }
      },
      "additionalProperties": true
    },
    "trust_path": {
      "type": "object",
      "required": [
        "issuer_legitimacy",
        "destination_binding",
        "runtime_safety",
        "scanner_decision"
      ],
      "properties": {
        "issuer_legitimacy": {
          "$ref": "#/$defs/trust_step"
        },
        "destination_binding": {
          "$ref": "#/$defs/trust_step"
        },
        "runtime_safety": {
          "$ref": "#/$defs/trust_step"
        },
        "scanner_decision": {
          "$ref": "#/$defs/trust_step"
        }
      },
      "additionalProperties": true
    },
    "hold_to_open": {
      "type": "object",
      "required": [
        "required",
        "duration_ms",
        "reason_codes"
      ],
      "properties": {
        "required": {
          "type": "boolean"
        },
        "duration_ms": {
          "type": "integer",
          "minimum": 0
        },
        "reason_codes": {
          "type": "array",
          "items": {
            "type": "string",
            "minLength": 1
          }
        }
      },
      "additionalProperties": true
    },
    "cache_freshness": {
      "type": "object",
      "required": [
        "status"
      ],
      "properties": {
        "status": {
          "enum": [
            "fresh",
            "stale",
            "expired",
            "unavailable",
            "not_applicable"
          ]
        },
        "cache_generated_at": {
          "type": [
            "string",
            "null"
          ],
          "format": "date-time"
        },
        "cache_expires_at": {
          "type": [
            "string",
            "null"
          ],
          "format": "date-time"
        }
      },
      "additionalProperties": true
    },
    "governance": {
      "type": "object"
    },
    "envelope_id": {
      "type": [
        "string",
        "null"
      ],
      "pattern": "^[0-9a-f]{64}$"
    },
    "residual_vector": {
      "type": "object",
      "propertyNames": {
        "$ref": "#/$defs/residual_family"
      },
      "required": [
        "issuer_chain",
        "destination_policy",
        "redirect_flow",
        "runtime_safety",
        "freshness",
        "artifact_integrity"
      ],
      "additionalProperties": {
        "$ref": "#/$defs/residual_entry"
      }
    },
    "model_decision": {
      "$ref": "#/$defs/model_decision"
    }
  },
  "additionalProperties": false,
  "$defs": {
    "trust_step": {
      "type": "object",
      "required": [
        "status",
        "label",
        "message"
      ],
      "properties": {
        "status": {
          "type": "string",
          "minLength": 1
        },
        "label": {
          "type": "string",
          "minLength": 1
        },
        "message": {
          "type": "string",
          "minLength": 1
        },
        "reason_codes": {
          "type": "array",
          "items": {
            "type": "string"
          }
        }
      },
      "additionalProperties": true
    },
    "residual_family": {
      "type": "string",
      "enum": [
        "issuer_chain",
        "destination_policy",
        "redirect_flow",
        "runtime_safety",
        "freshness",
        "artifact_integrity"
      ]
    },
    "residual_tier": {
      "type": "string",
      "enum": [
        "pass",
        "not-applicable",
        "not-checked",
        "unknown",
        "unavailable",
        "stale",
        "warn",
        "fail",
        "unaccepted-issuer",
        "invalid-managed-claim",
        "revoked-issuer",
        "block"
      ]
    },
    "residual_entry": {
      "type": "object",
      "required": [
        "tier",
        "cause"
      ],
      "additionalProperties": false,
      "properties": {
        "tier": {
          "$ref": "#/$defs/residual_tier"
        },
        "cause": {
          "oneOf": [
            {
              "type": "null"
            },
            {
              "$ref": "#/$defs/residual_cause"
            }
          ]
        }
      }
    },
    "residual_cause": {
      "type": "string",
      "enum": [
        "invalid-signature",
        "issuer-suspended",
        "issuer-revoked",
        "record-expired",
        "record-not-yet-valid",
        "key-revoked",
        "key-suspended",
        "key-window-mismatch",
        "trust-state-unavailable",
        "destination-not-authorized",
        "normalization-failure",
        "policy-invalid",
        "object-not-yet-valid",
        "object-expired",
        "nested-shortener",
        "depth-exceeded",
        "resolver-mismatch",
        "resolution-unavailable",
        "verdict-warn",
        "verdict-block",
        "verdict-expired",
        "verdict-stale",
        "provider-unavailable",
        "no-trust-claim",
        "invalid-trust-claim",
        "overlay-suspected",
        "conflicting-symbols",
        "framed-symbol-anomaly",
        "container-mismatch"
      ]
    },
    "model_decision": {
      "type": "object",
      "required": [
        "profile",
        "primary_state",
        "annotations",
        "reason_codes",
        "attention_level"
      ],
      "additionalProperties": false,
      "properties": {
        "profile": {
          "type": "string",
          "enum": [
            "strict-online",
            "bounded-online",
            "bounded-offline",
            "production-trusted",
            "reference-testing"
          ]
        },
        "primary_state": {
          "type": "string",
          "enum": [
            "unverified",
            "signed-unaccepted-issuer",
            "verified-issuer",
            "verified-issuer-destination-risky",
            "blocked"
          ]
        },
        "annotations": {
          "type": "array",
          "uniqueItems": true,
          "items": {
            "type": "string",
            "enum": [
              "artifact-warning",
              "stale-offline-warning",
              "limited-runtime-safety-visibility",
              "redirect-variation-warning",
              "invalid-trust-claim-warning",
              "policy-profile-warning",
              "incomplete-verification-warning"
            ]
          }
        },
        "reason_codes": {
          "type": "array",
          "items": {
            "type": "string"
          }
        },
        "attention_level": {
          "type": "string",
          "enum": [
            "positive",
            "neutral",
            "warning",
            "block"
          ]
        }
      }
    }
  }
}
